{
  "title": "No Private Interpretation? An Old and Neglected Doctrine Reaffirmed",
  "legacyPath": "/journal/articles/category/no-private-interpretation-an-old-and-neglected-doctrine-reaffirmed",
  "datePublished": "2024-09-08 15:00:48",
  "authors": [
    "AllenBaird"
  ],
  "tags": [],
  "rawCategories": [
    "issue-35-autumn-2002"
  ],
  "primaryCategory": "issue-35-autumn-2002",
  "issueNumber": 35,
  "issueYear": 2002,
  "section": "journal-article"
}
