{
  "title": "The Decline of Reformation Calvinism in 19th Cent. Scotland Part Five The Erosion of Biblical Psalmody in Scots Presbyterianism",
  "legacyPath": "/journal/articles/category/the-erosion-of-biblical-psalmody-in-scots-presbyterianism",
  "datePublished": "2019-04-18 22:36:56",
  "authors": [
    "H.L.Williams"
  ],
  "tags": [
    "church history",
    "exclusive psalmody"
  ],
  "rawCategories": [
    "issue-27-july-september-1999"
  ],
  "primaryCategory": "issue-27-july-september-1999",
  "issueNumber": 27,
  "issueYear": 1999,
  "section": "journal-article"
}
