{
  "title": "Behold, I Come Quickly",
  "legacyPath": "/literature/category/be-ye-holy-2g2e3",
  "datePublished": "2018-08-27 05:07:39",
  "authors": [
    "manuelkuhs@gmail.com"
  ],
  "tags": [
    "David J. Engelsma",
    "Andrew Lanning"
  ],
  "rawCategories": [
    "book"
  ],
  "primaryCategory": "book",
  "issueNumber": null,
  "issueYear": null,
  "section": "journal-article"
}
