{
  "title": "Anatomy of a Revival (5)",
  "legacyPath": "/journal/articles/articles/category/anatomy-of-a-revival-5",
  "datePublished": "2019-04-23 21:13:04",
  "authors": [
    "H.L.Williams"
  ],
  "tags": [
    "revivals"
  ],
  "rawCategories": [
    "issue-44-winter-2005"
  ],
  "primaryCategory": "issue-44-winter-2005",
  "issueNumber": 44,
  "issueYear": 2005,
  "section": "journal-article"
}
