{
  "title": "Edited Half Away",
  "legacyPath": "/journal/articles/category/edited-half-away",
  "datePublished": "2019-04-18 18:13:30",
  "authors": [
    "RonaldHanko"
  ],
  "tags": [],
  "rawCategories": [
    "issue-25-january-march-1999"
  ],
  "primaryCategory": "issue-25-january-march-1999",
  "issueNumber": 25,
  "issueYear": 1999,
  "section": "journal-article"
}
