{
  "title": "The Meaning of Baptism with Special Reference to the Baptist View (1)",
  "legacyPath": "/journal/articles/british-reformed-journal/issue-29-january-march-2000/the-meaning-of-baptism-with-special-reference-to-the-baptist-view-1",
  "datePublished": "2010-10-30 00:00:00",
  "authors": [
    "AngusStewart"
  ],
  "tags": [
    "Translated",
    "Italian",
    "baptism"
  ],
  "rawCategories": [
    "issue-29-january-march-2000"
  ],
  "primaryCategory": "issue-29-january-march-2000",
  "issueNumber": 29,
  "issueYear": 2000,
  "section": "journal-article"
}
