{
  "title": "House-Churchism: An Ecclesiastical Panacea or Poison? (2)",
  "legacyPath": "/journal/articles/articles/category/house-churchism-an-ecclesiastical-panacea-or-poison-2",
  "datePublished": "2020-05-31 21:08:43",
  "authors": [
    "SamuelWatterson"
  ],
  "tags": [
    "ecclesiology"
  ],
  "rawCategories": [
    "issue-70-win-2019-2020"
  ],
  "primaryCategory": "issue-70-win-2019-2020",
  "issueNumber": 70,
  "issueYear": 2019,
  "section": "journal-article"
}
