{
  "title": "Of communion With God the Father, Son and Holy Ghost (2)",
  "legacyPath": "/journal/articles/category/of-communion-with-god-the-father-son-and-holy-ghost-2",
  "datePublished": "2017-07-16 20:14:10",
  "authors": [
    "JohnOwen"
  ],
  "tags": [
    "trinity",
    "christian living"
  ],
  "rawCategories": [
    "issue-63"
  ],
  "primaryCategory": "issue-63",
  "issueNumber": 63,
  "issueYear": null,
  "section": "journal-article"
}
