{
  "title": "Editorial Book Review: \"Keeping God’s Covenant\" by Herman Hanko and David Engelsma)",
  "legacyPath": "/journal/articles/british-reformed-journal/issue-47-summer-2007/editorial-keeping-gods-covenant-a-review-of-keeping-gods-covenant-by-herman-hanko-and-david-engelsma",
  "datePublished": "2010-09-12 15:58:43",
  "authors": [
    "MichaelKimmitt"
  ],
  "tags": [
    "book review",
    "editorial",
    "covenant"
  ],
  "rawCategories": [
    "issue-47-summer-2007"
  ],
  "primaryCategory": "issue-47-summer-2007",
  "issueNumber": 47,
  "issueYear": 2007,
  "section": "journal-article"
}
