{
  "title": "Book Review: Institutes of Elenctic Theology by Francis Turretin",
  "legacyPath": "/journal/articles/british-reformed-journal/issue-3-july-september-1993/francis-turretin-institutes-of-elenctic-theology",
  "datePublished": "2012-10-30 00:00:06",
  "authors": [
    "H.L.Williams"
  ],
  "tags": [
    "book review"
  ],
  "rawCategories": [
    "issue-03-july-september-1993"
  ],
  "primaryCategory": "issue-03-july-september-1993",
  "issueNumber": 3,
  "issueYear": 1993,
  "section": "journal-article"
}
