{
  "title": "Book Reviews: Particular Grace by Abraham Kuyper &amp; Redeem the Time by Steve Griffiths",
  "legacyPath": "/journal/articles/category/book-reviews-particular-grace-by-abraham-kuyper-amp-redeem-the-time-by-steve-griffiths",
  "datePublished": "2024-09-08 15:06:03",
  "authors": [
    "AllenBaird"
  ],
  "tags": [
    "book review",
    "abraham kuyper",
    "john owen"
  ],
  "rawCategories": [
    "issue-35-autumn-2002"
  ],
  "primaryCategory": "issue-35-autumn-2002",
  "issueNumber": 35,
  "issueYear": 2002,
  "section": "journal-article"
}
