{
  "title": "Giving the Arminian Babel a Shake: The Wesley-Toplady Controversy (1)",
  "legacyPath": "/journal/articles/british-reformed-journal/issue-38-summer-2003/giving-the-arminian-babel-a-shake-the-wesley-toplady-controversy-1",
  "datePublished": "2010-10-30 00:00:00",
  "authors": [
    "BillLangerak"
  ],
  "tags": [
    "calvinism",
    "arminianism",
    "church history",
    "wesley"
  ],
  "rawCategories": [
    "issue-38-summer-2003"
  ],
  "primaryCategory": "issue-38-summer-2003",
  "issueNumber": 38,
  "issueYear": 2003,
  "section": "journal-article"
}
