{
  "title": "A Plea for Creeds",
  "legacyPath": "/journal/articles/british-reformed-journal/issue-21-january-march-1998/a-plea-for-creeds",
  "datePublished": "2010-10-30 00:00:00",
  "authors": [
    "RonaldHanko"
  ],
  "tags": [
    "Translated",
    "Polish",
    "German",
    "creeds & confessions"
  ],
  "rawCategories": [
    "issue-21-january-march-1998"
  ],
  "primaryCategory": "issue-21-january-march-1998",
  "issueNumber": 21,
  "issueYear": 1998,
  "section": "journal-article"
}
