{
  "title": "The Scriptural Presentation of God's Hatred",
  "legacyPath": "/journal/articles/category/the-scriptural-presentation-of-gods-hatred",
  "datePublished": "2019-04-23 20:40:59",
  "authors": [
    "HomerC.Hoeksema"
  ],
  "tags": [
    "reprobation",
    "calvinism"
  ],
  "rawCategories": [
    "issue-42-spring-2005"
  ],
  "primaryCategory": "issue-42-spring-2005",
  "issueNumber": 42,
  "issueYear": 2005,
  "section": "journal-article"
}
