{
  "title": "The Fight for the Reformed Faith: DEBATE ON REDEMPTION AT THE WESTMINSTER ASSEMBLY",
  "legacyPath": "/journal/articles/british-reformed-journal/issue-09-january-march-1995/the-fight-for-the-reformed-faith",
  "datePublished": "2010-10-30 00:00:00",
  "authors": [
    "DavidBlunt"
  ],
  "tags": [
    "church history",
    "well-meant offer"
  ],
  "rawCategories": [
    "issue-13-january-march-1996"
  ],
  "primaryCategory": "issue-13-january-march-1996",
  "issueNumber": 13,
  "issueYear": 1996,
  "section": "journal-article"
}
