{
  "title": "The Development of the Doctrine of the Covenant (4): Augustine and Sovereign Grace",
  "legacyPath": "/journal/articles/british-reformed-journal/issue-36-winter-2003/the-development-of-the-doctrine-of-the-covenant-4-augustine-and-sovereign-grace",
  "datePublished": "2010-09-12 16:21:31",
  "authors": [
    "AngusStewart"
  ],
  "tags": [
    "Translated",
    "Spanish",
    "church history"
  ],
  "rawCategories": [
    "issue-36-winter-2003"
  ],
  "primaryCategory": "issue-36-winter-2003",
  "issueNumber": 36,
  "issueYear": 2003,
  "section": "journal-article"
}
