{
  "title": "The 1,000 Years of Revelation 20 (1)",
  "legacyPath": "/journal/articles/british-reformed-journal/issue-48-winter-2008/the-1000-years-of-revelation-20-1",
  "datePublished": "2010-08-04 12:25:37",
  "authors": [
    "AngusStewart"
  ],
  "tags": [
    "Translated",
    "Polish",
    "eschatology"
  ],
  "rawCategories": [
    "issue-48-winter-2008"
  ],
  "primaryCategory": "issue-48-winter-2008",
  "issueNumber": 48,
  "issueYear": 2008,
  "section": "journal-article"
}
