{
  "title": "The Free Offer Issue (1)",
  "legacyPath": "/journal/articles/british-reformed-journal/issue-44-winter-2005/the-free-offer-issue-1",
  "datePublished": "2010-09-12 16:21:31",
  "authors": [
    "H.L.Williams"
  ],
  "tags": [
    "well-meant offer",
    "calvinism"
  ],
  "rawCategories": [
    "issue-44-winter-2005"
  ],
  "primaryCategory": "issue-44-winter-2005",
  "issueNumber": 44,
  "issueYear": 2005,
  "section": "journal-article"
}
