{
  "title": "The Reformed Worldview",
  "legacyPath": "/literature/books-a-pamphlets/books/the-reformed-worldview",
  "datePublished": "2012-09-17 00:00:00",
  "authors": [
    "manuelkuhs@gmail.com"
  ],
  "tags": [
    "Herman Hanko",
    "David J. Engelsma"
  ],
  "rawCategories": [
    "book"
  ],
  "primaryCategory": "book",
  "issueNumber": null,
  "issueYear": null,
  "section": "journal-article"
}
