{
  "title": "Robust Christianity",
  "legacyPath": "/journal/articles/british-reformed-journal/issue-3-july-september-1993/robust-christianity",
  "datePublished": "2012-10-30 00:00:04",
  "authors": [
    "J.C.Ryle"
  ],
  "tags": [],
  "rawCategories": [
    "issue-03-july-september-1993"
  ],
  "primaryCategory": "issue-03-july-september-1993",
  "issueNumber": 3,
  "issueYear": 1993,
  "section": "journal-article"
}
