{
  "title": "A Report on the 2022 BRF Conference",
  "legacyPath": "/journal/articles/category/the-reformed-family-authoritative-content-of-the-gospel-rhnp4-hx2r6",
  "datePublished": "2023-10-08 09:02:46",
  "authors": [
    "BrianHarris"
  ],
  "tags": [
    "brf conference review"
  ],
  "rawCategories": [
    "issue-74-summer-2022"
  ],
  "primaryCategory": "issue-74-summer-2022",
  "issueNumber": 74,
  "issueYear": 2022,
  "section": "journal-article"
}
