{
  "title": "The Five Points of Calvinism",
  "legacyPath": "/literature/books-a-pamphlets/books/the-five-points-of-calvinism",
  "datePublished": "2010-07-24 16:57:57",
  "authors": [
    "manuelkuhs@gmail.com"
  ],
  "tags": [
    "Herman Hanko",
    "David J. Engelsma"
  ],
  "rawCategories": [
    "book"
  ],
  "primaryCategory": "book",
  "issueNumber": null,
  "issueYear": null,
  "section": "journal-article"
}
