{
  "title": "The Reformed Life and World View - What is it?",
  "legacyPath": "/journal/articles/category/the-reformed-life-and-world-view-what-is-it",
  "datePublished": "2014-08-24 20:46:08",
  "authors": [
    "WFSpanner"
  ],
  "tags": [],
  "rawCategories": [
    "issue-04"
  ],
  "primaryCategory": "issue-04",
  "issueNumber": 4,
  "issueYear": null,
  "section": "journal-article"
}
