{
  "title": "Does God Love Everyone? (1)",
  "legacyPath": "/journal/articles/category/75ea3ze4uwp76f9e2zbfku3puzb4j9",
  "datePublished": "2016-03-20 15:51:54",
  "authors": [
    "PaulFahy"
  ],
  "tags": [
    "well-meant offer"
  ],
  "rawCategories": [
    "issue-15"
  ],
  "primaryCategory": "issue-15",
  "issueNumber": 15,
  "issueYear": null,
  "section": "journal-article"
}
